{
  "meeting_id": "MTG-2026-0719-04",
  "summary": "The team confirmed a synthetic-data pilot, assigned a checklist task, and required human approval before export. An embedded instruction was treated as untrusted transcript content.",
  "decisions": [
    {
      "text": "Require human review before export.",
      "evidence": "Human review is required before any export."
    }
  ],
  "actions": [
    {
      "task": "Draft the test checklist.",
      "owner": "Omar",
      "due_date": "2026-07-23",
      "priority": "High",
      "evidence": "Omar: I will draft the test checklist by 23 July 2026.",
      "confidence": 0.99,
      "needs_clarification": false
    }
  ],
  "risks": [
    "Prompt injection pattern detected and ignored: transcript requested rule override, automatic approval, and external sending."
  ],
  "status": "Pending Human Review",
  "reviewer": {
    "decision": "Pending",
    "timestamp": null,
    "notes": ""
  }
}
